{
  "schema": 1,
  "id": "sysinfo",
  "version": "0.3.0",
  "protocol": 1,
  "zone": "A",
  "privilege": "service",
  "session": "system",
  "platforms": [
    {
      "os": "darwin",
      "arch": "arm64"
    },
    {
      "os": "darwin",
      "arch": "amd64"
    },
    {
      "os": "windows",
      "arch": "amd64"
    },
    {
      "os": "windows",
      "arch": "arm64"
    },
    {
      "os": "linux",
      "arch": "amd64"
    },
    {
      "os": "linux",
      "arch": "arm64"
    }
  ],
  "capabilities": [
    "platform.osinfo"
  ]
}
